Unnamed: 0,title,stock,Date,sentiment_score
841090,#Premarket Prep Technical Update - Merck Trading Lower Again,MRK,2014-05-08,-0.01
841091,"This Morning BMO Capital Downgraded Merck & Company to Market Perform, Lowered PT to $60.00",MRK,2014-05-08,-0.43
841092,Merck Announces Results Show Letermovir In CMV-Seropositive Allogeneic Human Blood Precursor Cell Recipients Met Study's Two Primary Efficacy Endpoints,MRK,2014-05-08,0.06
841093,Market Wrap For May 7: Dow Banks Triple-Digit Point Gain While Nasdaq Closes Lower,MRK,2014-05-07,0.00
841094,#Premarket Technical Update -  Merck Trading Lower,MRK,2014-05-07,-0.01
841095,Merck Shares Tumble 2+% Following Morgan Stanley Downgrade,MRK,2014-05-07,-0.51
841096,"Market Wrap For May 6: Dow Suffers Triple-Digit Point Loss, Nasdaq Underperforms Once Again",MRK,2014-05-06,-0.16
841097,#Premarket Prep Technical Update - Merck Trading Sharply Lower,MRK,2014-05-06,-0.19
841098,Fitch Says Merck Consumer Business Sale Improves Its Core Focus,MRK,2014-05-06,0.22
841099,Merck Says Global Cancer Sales Could Reach $120B by 2020 ,MRK,2014-05-06,-0.01
841100,Merck CEO Says Would be Interested in Acquiring Animal Health Brands with the Right Products at the Right Price -Reuters,MRK,2014-05-06,0.23
841101,Merck Says May Look to M&A For Biotech Expansion- Bloomberg,MRK,2014-05-06,0.00
841102,UPDATE: Merck Highlights Strategic Initiative,MRK,2014-05-06,0.39
841103,"Merck Offers Details of Plans to File Odanacatib for Osteoporoisis in 2H, Will Continue to Explore Ways to Augment Animal Health Unit",MRK,2014-05-06,0.01
841104,Merck Announces FDA Acceptance for Review of MK-3475,MRK,2014-05-06,0.01
841105,US Stock Futures Flat Ahead Of International Trade Data ,MRK,2014-05-06,-0.04
841106,Merck Announces Sale of Consumer Care Business to Bayer for $14.2B,MRK,2014-05-06,0.01
841107, Bayer to Buy Merck Consumer Care Ops for $14.2B,MRK,2014-05-06,0.00
841108,"ETF Outlook For The Week Of May 5, 2014 (NGE, XLU, USMV, JJN)",MRK,2014-05-05,0.00
841109,Market Wrap For May 2: Markets Slip On Ukraine Tensions Despite Positive Jobs Data ,MRK,2014-05-02,-0.10
841110,"Sanofi, Merck Rumored to Each Weigh Sale of Mature-Drug Portfolios - Bloomberg",MRK,2014-05-02,0.00
841111,#Premarket Preo Technical Update - Merck Trading Lower,MRK,2014-05-02,0.00
841112,Endocyte to Resume Trading at 8:30 AM ET,MRK,2014-05-02,0.01
841113,Merck Endocyte Announce Independent DSMB Recommends Vintafolide PROCEED Phase 3 Trial Be Stopped for Futility Following Interim Analysis ,MRK,2014-05-02,-0.06
841114,"Merck, Endocyte Report DSMB Has Recommended Vintafolide Trial Be Suspended, Cites Trial Not Showing Efficacy",MRK,2014-05-02,-0.20
841115,"Benzinga's M&A Chatter for Thursday May 1, 2014",MRK,2014-05-01,0.00
841116,Bayer Could Be Preparing ~$14B Bid for Merck's Consumer Unit - Bloomberg,MRK,2014-05-01,0.00
841117,#Premarket Prep Technical Update - Merck Trading Lower,MRK,2014-04-30,-0.01
841118,Reckitt Benckiser Confirms it is No Longer in Talks with Merck Regarding Bid for Consumer Health Business,MRK,2014-04-30,0.01
841119,"#PreMarket Primer: Wednesday, April 30: No BOJ Stimulus On The Horizon ",MRK,2014-04-30,0.01
841120,Market Wrap For April 29: Dow Approaches Record Highs Despite Ongoing Ukraine Tension and Upcoming Fed Meeting ,MRK,2014-04-29,0.00
841121,Mid-Afternoon Market Update: Markets Show Strength as Prothena Shares Plummet,MRK,2014-04-29,-0.33
841122,"Bids for Merck Consumer-Health Unit Said to Be Over $14B, Bayer Looking to Weigh JV with Merck as Part of Offer - Bloomberg",MRK,2014-04-29,0.00
841123,#Premarket Technical Update -Merck Trading Higher,MRK,2014-04-29,0.01
841124,Mid-Day Market Update: Coach Slips After Q3 Results; Orbital Shares Spike Higher,MRK,2014-04-29,-0.02
841125,Mid-Morning Market Update: Markets Rise; Merck Earnings Beat Street View,MRK,2014-04-29,0.54
841126,UPDATE: Merck Posts Upbeat Q1 Profit,MRK,2014-04-29,0.78
841127,"#PreMarket Primer: Tuesday, April 29: US Steps Up Sanctions Against Russia",MRK,2014-04-29,-0.01
841128,"Merck & Company, Inc. Reports Q1 EPS of $0.88 vs $0.79 Est; Revenue of $10.30B vs $10.44B Est; Reaffirms Outlook",MRK,2014-04-29,0.04
841129,Market Wrap For April 28: Apple Hits New 52-Week Highs In a Volatile Start To the Trading Week,MRK,2014-04-28,0.14
841130,"Reckitt Benckiser Confirms Talks With Merck Regarding Bid for Consumer Health Business, Bayer Also Rumored Bidder",MRK,2014-04-28,0.00
841131,"Agenus Announces License Deal with Merck Related to Novel Checkpoint Antibody-Based Cancer Immunotherapies, Eligible for ~$100M in Milestone Payments",MRK,2014-04-28,0.26
841132,Benzinga's Weekend M&A Chatter,MRK,2014-04-27,0.01
841133,"Earnings Expectations For The Week Of April 28: Big Oil, Big Pharma And More",MRK,2014-04-27,0.02
841134,"Reuters Reports Merck in Talks to Sell Consumer Health Unit to Bayer, Reckitt Benckiser for Approximately $14B, According to Sources ",MRK,2014-04-26,0.00
841135,Benzinga Weekly Preview: Earnings Season Continues As Biotech & Pharmaceutical Companies Report,MRK,2014-04-25,0.08
841136,3 Ways To Profit From Merger Activity In The Pharmaceutical Sector,MRK,2014-04-25,0.10
841137,Market Wrap For April 24: Apple's Smashing Earnings Overshadowed By Ukraine Concerns,MRK,2014-04-24,-0.01
841138,Fitch Affirms Merck's LT IDR at A+; Outlook Negative,MRK,2014-04-24,-0.39
841139,"Bank of America Maintains Buy on Merck & Company, Inc., Raises PT to $62.00",MRK,2014-04-24,0.01
841140,#Premarket Technical Update -Merck Trading Lower,MRK,2014-04-23,-0.01
841141,Bill Ackman Talks Partnership With Valeant For Allergan Deal ,MRK,2014-04-23,0.01
841142,The Top 21 African-American CEOs In Business,MRK,2014-04-21,0.01
841143,FDA Clears Merck's Ragwitek ,MRK,2014-04-17,-0.01
841144,Merck Announces FDA Has Approved Grastek Sublingual Tablet for Treatment of Grass Pollen-Induced Allergic Rhinitis,MRK,2014-04-14,-0.02
841145,"Market Wrap For April 14: Markets Surge on Positive Retail Data, Citi Earnings",MRK,2014-04-14,0.51
841146,Markets Falling? Get Your Defense Ready,MRK,2014-04-14,-0.01
841147,No Legwork Mondays – Merck And Vioxx,MRK,2014-04-14,0.02
841148,Top 40 Upcoming Earnings Releases  ,MRK,2014-04-11,0.03
841149,Google Honors Chemist Percy Julian & His Contributions ,MRK,2014-04-11,0.17
841150,US Stock Futures Slip Ahead Of Consumer Sentiment Report,MRK,2014-04-11,-0.27
841151,Phase 2 Trial of Merck's Investigational Chronic Hepatitis C Combination Therapy MK-5172/MK-8742 Demonstrates Antiviral Activity,MRK,2014-04-11,0.00
841152,"When It Comes To Drug Stocks, Do Not Always Buy The News",MRK,2014-04-10,0.10
841153,US Stock Futures Edge Lower Ahead Of Jobless Claims Data,MRK,2014-04-10,-0.41
841154,"Merck Announces Results from Studies Evaluating MK-5172 and MK-8742 Investigational Hepatitis C Treatments, ",MRK,2014-04-10,0.00
841155,Biotechs Struggling To Find A Bottom,MRK,2014-04-08,-0.27
841156,"Express Scripts Reports Spending on Hepatitis C Medications in US to Rise 1,800% by 2016",MRK,2014-04-08,-0.11
841157,Merck Presents Early Findings from MK-3475 Treatment at AARC 2014,MRK,2014-04-06,0.01
841158,Merck Shares Volatile This Afternoon; Reuters Earlier Reported Co. is Seeing Resistance from Beef Industry for Test of Zilmax on 200K+ Cattle ,MRK,2014-04-04,-0.14
841159,"Merck Announces Appointment of Robert M. Davis as Chief Financial Officer; Succeeds Peter N. Kellogg, Who Has Served in the Role Since 2007",MRK,2014-03-27,0.00
841160,"Merck Names Robert Davis as CFO, Succeeding Peter Kellogg",MRK,2014-03-27,0.00
841161,Nanobio Announces Licensing Agreement With Unit of Merck for Use of its Nanoemulsion Adjuvant Technology,MRK,2014-03-26,0.02
841162,Nanobio Announces Licensing Agreement With Unit of Merck for Use of its Nanoemulsion Adjuvant Technology,MRK,2014-03-26,0.02
841163,"Reckitt Benckiser a Frontrunner for Merck's OTC Segment, Sanofi Rumored to Join Bidders, Final Bids Are Due Next Week - Bloomberg",MRK,2014-03-24,0.01
841164,Google Honors Activist Dorothy Height & Her Contributions,MRK,2014-03-24,0.26
841165,Mid-Day Market Update: Nike Drops On Cautious Forecast; Endocyte Shares Spike Higher,MRK,2014-03-21,-0.01
841166,"""Premarket Prep"" Technical Update - Merck Trading Lower After Higher Open",MRK,2014-03-21,0.00
841167,Mid-Morning Market Update: Markets Open Higher; Tiffany Posts Downbeat Earnings,MRK,2014-03-21,0.02
841168,Benzinga's Volume Movers,MRK,2014-03-21,0.01
841169,UPDATE: Endocyte Shares Rise 158%,MRK,2014-03-21,0.07
841170,UPDATE: Endocyte Shares Rise 91% on European CHMP Positive Opinions for VYNFINIT,MRK,2014-03-21,0.29
841171,PREVIEW: Endocyte to Resume Trading at 8:30AM ET,MRK,2014-03-21,0.00
841172,Benzinga's Top #PreMarket Gainers,MRK,2014-03-21,0.15
841173,"Merck, Endocyte Announce European CHMP Positive Opinions for VYNFINIT, Companion Agents FOLCEPRI, NEOCEPRI",MRK,2014-03-21,0.04
841174,Ligand Pharma Announces $1M Milestone Payment Triggered Following FDA Approval of Merck's Noxafil,MRK,2014-03-17,0.07
841175,UPDATE: FDA Approves Merck Noxafi Injection for IV Use,MRK,2014-03-14,0.11
841176,FDA Approves Merck Noxafi Injection for Intravenous Use ,MRK,2014-03-14,0.03
841177,Merck Unchanged,MRK,2014-03-12,0.03
841178,Merck Trading Higher,MRK,2014-03-06,0.03
841179,"Merck Announces MK-1439 Shows Antiviral Activity in Phase 2b Trial, Co. Planning to Initiate Phase 2 Development Program During 2H'14",MRK,2014-03-05,0.03
841180,UPDATE: Merck Plans to Initiate Phase 3 Clinical Development Program In Second Half Of 2014 ,MRK,2014-03-05,0.03
841181,"Merck's Investigational HIV Therapy, Doravirine (MK-1439), Demonstrates Antiviral Activity in Phase 2B Study of Treatment-Naïve Adults ",MRK,2014-03-05,0.00
841182,"Merck Issues Results from Phase 2b Study of MK-8237, Says Secondary Efficacy Endpoints Average TNSS, DU Made Significant Dose, Time Dependent Reduction",MRK,2014-03-04,-0.01
841183,Biotechs vs. Pharmaceuticals: What's the Difference?,MRK,2014-03-04,0.00
841184,The Top Five Dow Stocks In February,MRK,2014-03-03,0.02
841185,"Overvaluing Liquidity: Invest For The Future, Not For Today",MRK,2014-02-28,-0.09
841186,CHMP Issues Positive Opinion For Tablet Formulation Of Merck's NOXAFIL,MRK,2014-02-28,0.00
841187,HB Reporting (via Bloomberg) Merck is Still Interested in More Purchases in the Pharma Group,MRK,2014-02-20,0.00
841188,Merck Testing Multi-Year Highs,MRK,2014-02-20,0.06
841189,Merck Reports FDA Acceptance for Review of BLA for V503,MRK,2014-02-20,0.00
841190,"FDA Accepts for Review Merck's Biologics License Application for V503, Investigational 9-valent Human Papillomavirus Vaccine",MRK,2014-02-20,0.02
841191,Merck Finds Resistance,MRK,2014-02-12,-0.01
841192,"Three ETFs To Buy On The Pullback (PJP, SKYY, SPY)",MRK,2014-02-10,0.00
841193,"Merck, Samsung Bioepis Announce Deal to Develop Insulin Glargine Candidate",MRK,2014-02-10,0.01
841194,"Market Wrap For February 7: Jobs Report Not Great, But Not Too Bad",MRK,2014-02-07,-0.72
841195,Bloomberg Reporting Merck Has Reached Agreement in Principle to Resolve Suits Related to NuvaRing,MRK,2014-02-07,0.02
841196,Bloomberg Reporting Merck Said to Agree to Pay $100M Related to NuvaRing Settlement,MRK,2014-02-06,0.00
841197,"#PreMarket Primer: Thursday, February 6: Markets Taking A Breather After Twitter Earnings",MRK,2014-02-06,0.00
841198,Market Wrap For February 5: Markets Unsure Of Which Direction To Take,MRK,2014-02-05,-0.01
841199,Merck Retreats From Highs,MRK,2014-02-05,0.01
841200,Top Trending Tickers On StockTwits For February 5,MRK,2014-02-05,0.02
841201,Stocks Hitting 52-Week Highs,MRK,2014-02-05,0.54
841202,Benzinga's Top #PreMarket Gainers,MRK,2014-02-05,0.15
841203,UPDATE: Merck Posts Drop In Q4 Profit,MRK,2014-02-05,0.02
841204,"Merck & Company, Inc. Sees FY2014 EPS $3.35-3.53 vs $3.47 Est; Sees Sales $42.40B-43.20B vs $43.54B Est",MRK,2014-02-05,0.01
841205,US Stock Futures Flat; All Eyes On ADP Report,MRK,2014-02-05,-0.02
841206,"Merck & Company, Inc. Reports Q4 Adjusted EPS of $0.88, Inline; Revenue of $11.32B vs $11.36B Est",MRK,2014-02-05,0.00
841207,Pfizer Confirms Collaboration with Merck on Innovative Anti-Cancer Combination Studies ,MRK,2014-02-05,0.26
841208,Incyte Confirms Clinical Trial Collaboration with Merck to Evaluate Combination of Two Novel Immunotherapies ,MRK,2014-02-05,0.10
841209,"Merck Confirms Collaborations with Amgen, Incyte and Pfizer to Evaluate Novel Combination Anti-cancer Regimens with MK-3475 ",MRK,2014-02-05,0.01
841210,"Amgen,Merck Announce Collaboration to Evaluate Investigational Combination Treatment for Advanced Melanoma",MRK,2014-02-05,0.02
841211,"Earnings Scheduled For February 5, 2014",MRK,2014-02-05,0.01
841212,"Stocks To Watch For February 5, 2014",MRK,2014-02-05,0.01
841213,Merck Rallies Back,MRK,2014-02-04,0.12
841214,"SunTrust Robinson Humphrey Upgrades Merck & Company, Inc. to Buy",MRK,2014-02-04,0.02
841215,Merck Receives Canadian Approval of Grastek,MRK,2014-02-03,0.12
841216,"Earnings Expectations For The Week Of February 3: GM, Twitter, Disney And More",MRK,2014-02-03,0.01
841217,Market Wrap For January 31: Markets End January On Sour Note,MRK,2014-01-31,0.00
841218,Reuters Reporting Merck Consumer Health Unit Could Get $8-10B in Sale,MRK,2014-01-31,0.00
841219,"Market Wrap For January 27: China Concerns, Declining Home Sales, Tomorrow's Fed Meeting and Obama's Speech Keep Markets Lower",MRK,2014-01-27,-0.28
841220,Winter's Stock Knockdown May Give Way To A Spring Thaw,MRK,2014-01-27,-0.01
841221,UPDATE: Merck Upgraded by Morgan Stanley on Oncology Optimism,MRK,2014-01-27,0.03
841222,Stocks Hitting 52-Week Highs,MRK,2014-01-27,0.54
841223,Benzinga's Top Upgrades,MRK,2014-01-27,0.15
841224,US Stock Futures Gain Ahead Of Home-Sales Data,MRK,2014-01-27,0.21
841225,"Morgan Stanley Upgrades Merck & Company, Inc. to Overweight, Announces $60.00 PT",MRK,2014-01-27,0.00
841226,Merck Shares Higher Following Bristol-Myers' Phase 3 Disappointment,MRK,2014-01-24,-0.43
841227,Merck Pleased with FDA Advisory Committee Recommendation for Approval of Vorapaxar,MRK,2014-01-15,0.05
841228,Market Wrap For January 15: Bulls Take Over As Economic Growth Remains Healthy,MRK,2014-01-15,0.44
841229,Bloomberg First Word Reporting Merck Has Won FDA Advisory Panel Support for Vorapaxar,MRK,2014-01-15,0.01
841230,"Merck Voluntarily Recalls All Lots of Liptruzet, Cites Packaging Defects",MRK,2014-01-14,-0.34
841231,"Benzinga's M&A Chatter for Monday January 13, 2014",MRK,2014-01-13,0.00
841232,Market Wrap For January 13: Markets Showing Weakness Ahead Of Major Earning Releases,MRK,2014-01-13,-0.39
841233,Mid-Afternoon Market Update: Markets Dip Despite Large Amount of M&A,MRK,2014-01-13,-0.09
841234,Mid-Day Market Update: SodaStream Drops After Weak Outlook; Beam Shares Spike Higher,MRK,2014-01-13,-0.26
841235,Mid-Morning Market Update: Markets Open Lower; Lululemon Lowers Q4 Outlook,MRK,2014-01-13,-0.41
841236,Morning Market Movers ,MRK,2014-01-13,0.04
841237,Merck Initiates Rolling Submission to FDA of US Biologics License Application for MK-3475,MRK,2014-01-13,0.01
841238,"Merck Begins Enrollment of BLA for MK-3475, Sees Completing Application in 1H'14",MRK,2014-01-13,0.01
841239,Benzinga's Top #PreMarket Gainers,MRK,2014-01-13,0.15
841240,"UPDATE: Novartis Could Swap Its Animal-Health, Human Vaccines Units for Merck's OTC Health-Products Unit",MRK,2014-01-08,0.00
841241,Bloomberg Reporting Novartis Said to Be in Talks with Merck on $5B Unit Swap,MRK,2014-01-08,0.00
841242,Merck Receives FDA Approval for Isentress for Pediatric ,MRK,2014-01-08,0.04
841243,WSJ Reporting Merck on 'Radically Reshaping R&D',MRK,2013-12-27,0.00
841244,ALK Reports FDA Panel Will Revie Ragweed Tablet,MRK,2013-12-26,0.00
841245,Merck Sues to Stop Generic NuvaRing,MRK,2013-12-26,-0.52
841246,Merck Spikes Higher on Positive Jim Cramer/Mad Money Comments,MRK,2013-12-18,0.10
841247,Merck Collaborates with GlaxoSmithKline on MK-3475,MRK,2013-12-18,0.02
841248,Merck Says Vintafolide Has Won Orphan Drug Designation for Ovarian Cancer,MRK,2013-12-17,-0.28
841249,"EMA Says Will Discuss Extension of Indication for Merck's Noxafil, Isentress, Pfizer's Vfend, Amgen's Xgeva, Vertex Pharma's Kalydeco",MRK,2013-12-17,0.00
841250,FDA Reviewing Merck's Bid for Grastek; Panel Recommends Approval of Grastek; ,MRK,2013-12-12,0.01
841251,"#PreMarket Primer: Thursday, December 12: US Budget Deal Gaining Momentum",MRK,2013-12-12,0.06
841252,Merck Says Data Monitoring Committee Recommending Continuation of Phase II/III EPOCH Study for MK-8931,MRK,2013-12-10,0.00
841253,Merck Agrees to settle Litigation over Jaw Injuries Caused by Fosamax -Reuters,MRK,2013-12-09,-0.06
841254,"Bloomberg Reporting Merck, Eli Lilly Rumored to Be Interested in Novartis' Veterinary Unit",MRK,2013-12-03,0.00
841255, Merck Raises Quarterly Dividend to $0.44 from $0.43,MRK,2013-11-26,0.16
841256,FDA Okays Merck's Noxafil DR Tablets,MRK,2013-11-26,0.02
841257,Merck Announces Position Opinion from CHMP on Update for Erbitux Metastatic Colorectal Cancer Labeling,MRK,2013-11-22,0.00
841258,Investing in Companies Developing Promising Immunotherapy Drugs for Melanoma ,MRK,2013-11-18,0.19
841259,Merck's NDA for Noxafil Wins FDA Priority Review ,MRK,2013-11-18,0.11
841260,Merck's MK-7243 Significantly Reduced Allergy Symptoms in Adults and Children in Pivotal Phase III Study ,MRK,2013-11-09,0.26
841261,Job Cuts Higher in October; Pharmaceutical & Financial Sectors Took Biggest Hits,MRK,2013-11-06,-0.64
841262,Analysts Comment on Merck's Hep C Regiment Advances,MRK,2013-11-04,0.00
841263,"Merck Says Investigational V503 Prevented 97% of Cervical, Vaginal, Vulvar Pre-Cancers Caused by Five Added HPV Types",MRK,2013-11-04,-0.11
841264,"BMO Capital Upgrades Merck & Company, Inc. to Outperform",MRK,2013-11-01,0.10
841265,Market Wrap for October 31: Fed Worries Pull Stocks Lower,MRK,2013-10-31,-0.07
841266,US Stock Futures Flat Ahead Of Fed,MRK,2013-10-29,0.01
841267,"#PreMarket Primer: Tuesday, October 29: Fed Meeting Likely Uneventful",MRK,2013-10-29,0.00
841268,Merck Presents Interim Data from Phase 1B Study of MK-3475 at 15th World Conference on Lung Cancer ,MRK,2013-10-29,0.00
841269,Think Silver: Top Stocks Catering to Seniors,MRK,2013-10-28,0.00
841270,Mid-Afternoon Market Update: Markets Mixed as JC Penney Rises,MRK,2013-10-28,0.01
841271,Mid-Day Market Update: Burger King Surges On Upbeat Earnings; Sohu Shares Dip,MRK,2013-10-28,0.40
841272,Mid-Morning Market Update: Markets Mixed; Merck Profit Beats Estimates,MRK,2013-10-28,0.04
841273,Merck's Q3 Call Just Beginning,MRK,2013-10-28,0.01
841274,UPDATE: Merck Posts Upbeat Q3 Profit,MRK,2013-10-28,0.77
841275,"Merck & Company, Inc. Narrows FY2013 EPS Guidance from $3.45-3.55 to $3.48-3.52 vs $3.47 Est",MRK,2013-10-28,-0.04
841276,"Merck & Company, Inc. Reports Q3 EPS of $0.92 vs $0.88 Est; Revenue of $11.03B vs $11.19B Est",MRK,2013-10-28,0.01
841277,"#PreMarket Primer: Monday, October 28: All Eyes On Apple",MRK,2013-10-28,0.02
841278,"Earnings Scheduled For October 28, 2013",MRK,2013-10-28,0.01
841279,"Stocks To Watch For October 28, 2013",MRK,2013-10-28,0.01
841280,"Earnings Expectations For The Week Of October 28: Apple, Facebook, GM and More",MRK,2013-10-27,0.01
841281,Benzinga Weekly Preview: FOMC Meeting Closely Watched,MRK,2013-10-25,0.01
841282,"Short Sellers Retreat From Biogen Idec, Move On Pharmacyclics (BIIB, BMRN, PCYC)",MRK,2013-10-25,-0.06
841283,"Merck Says Primary Endpoints Met for Investigational 9-Valent HPV Vaccine, Expecting to Submit BLA for V503 in 2013",MRK,2013-10-24,0.00
841284,"Merck Says Primary Endpoints Met for Investigational 9-Valent HPV Vaccine, Expecting to Submit BLA for V503 in 2013",MRK,2013-10-24,0.00
841285,"How Investors Can Play the ""Losers"" in Blue Chips",MRK,2013-10-23,-0.10
841286,Merck's MK-5172/MK-8742 Receives Breakthrough Therapy Designation from FDA,MRK,2013-10-22,0.07
841287,"Merck Confirms Development of Investigational Dosing ISENTRESS, Will Begin Phase III Trial Early 2014",MRK,2013-10-16,0.02
841288,"Merck, Endocyte Report Vintafolide-PLD Generaly Well Tolerated, Showed Median PFS of Five Months",MRK,2013-10-14,0.33
841289,UPDATE: Bernstein Downgrades Merck & Co. on Negative Outlook,MRK,2013-10-14,-0.20
841290,"Barclays Downgrades Merck & Company, Inc. to Equalweight",MRK,2013-10-14,-0.14
841291,Benzinga's Top Downgrades,MRK,2013-10-14,0.00
841292,"Bernstein Downgrades Merck & Company, Inc. to Market Perform, Lowers PT to $50.00",MRK,2013-10-14,-0.46
841293,"Short Sellers Move On Amgen, Vertex (AMGN, PCYC, VRTX)",MRK,2013-10-11,0.00
841294,"Jefferies Downgrades Merck & Company, Inc. to Hold, Lowers PT to $50.00",MRK,2013-10-11,-0.27
841295,"Credit Suisse Starts Pfizer, Bristol-Myers, AbbVie, Allergan at Outperform, Merck, Eli Lilly, Forest Labs at Neutral",MRK,2013-10-08,0.03
841296,FDA Postpones Advisory Committee Meeting for Grass Ait Tablet Due to US Government Shutdown,MRK,2013-10-08,-0.30
841297,Merck Says Data Shows Cognigram as Sensitive Assessment,MRK,2013-10-07,0.00
841298,Pharmaceutical Industry Expected To Collect Billions From Obamacare,MRK,2013-10-02,0.01
841299,Merck Shares Soar After Announcing More Job Cuts,MRK,2013-10-01,-0.24
841300,Merck Says Interim Data for MK-3475 to be Presented at 15th World Conference on Lung Cancer,MRK,2013-10-01,-0.02
841301,"PreMarket Info Recap for October 1, 2013: Government Shutdown Gives Markets A Boost",MRK,2013-10-01,0.08
841302,"Merck Says Will Close Summit Campus, Will Move Global HQ to Kenilworth",MRK,2013-10-01,0.00
841303,UPDATE: Merck Announces Global Initiative to Sharpen Commercial and R&D Focus; Cutting 8500 Jobs; Affirms FY Target,MRK,2013-10-01,0.00
841304,"Merck Cutting 8,500 Jobs Related to Global Initiative to 'Sharpen Commercial, R&D Focus,' Sees Pretax Charge $2.5-3B, Reaffirms FY13 Outlook",MRK,2013-10-01,-0.34
841305,Merck Receives CRL for Investigational Medicine Sugammadex Sodium Injection,MRK,2013-09-23,0.01
841306,Write A Prescription For Health Care ETFs,MRK,2013-09-19,-0.04
841307,"Alexion, Pharmacyclics Buck Trend in Biotech Short Interest (ALXN, CELG, PCYC)",MRK,2013-09-14,0.01
841308,"Watch Shares of Caterpillar, Deere, Devon, Merck, and Oracle to the Downside on a Bearish Article from Jim Cramer Tweeted Out by Carl Icahn",MRK,2013-09-12,-0.01
841309,US Stock Futures Flat; Apple Shares Drop In Pre-Market Trading,MRK,2013-09-11,-0.29
841310,"Merck, AstraZeneca Announce License Agreement for MK-1775",MRK,2013-09-11,0.02
841311,USA TD Ameritrade's Investor Movement Index for Aug 5.16 vs 4.87 Prior,MRK,2013-09-09,0.00
841312,Merck Reports FDA Acceptance of NDA for Investigational Fertility Treatment,MRK,2013-09-09,0.01
841313,Merck's Durham Site Receives US FDA License for Varicella Bulk,MRK,2013-09-04,0.01
841314,Plenty Of ETFs With Favorable Risk Traits,MRK,2013-08-30,0.03
841315,"Short Interest In Celgene, Onyx Continues To Shrink (CELG, ONXX, VRTX)",MRK,2013-08-27,0.00
841316,"Chicago Tribune Running Story 'Cargill to stop buying cows fed with questionable growth drug,' Related to Merck's Zillmax",MRK,2013-08-26,-0.68
841317,"Merck Shares Down ~0.75% Today, But Have Been Relatively Quiet/Rangebound All Day; Traders Seemed to Shrug at Earlier Report Co. to Temporarily Halt Zilmax Sales",MRK,2013-08-16,-0.10
841318,"13F from Leon Cooperman's Omega Advisors Shows New Stakes in Thermo-Fisher, McKesson, Liquidated Stakes in Freeport-McMoRan, Facebook, Covidien, Raised Stakes in DISH, Citi, Lowered Stakes in Merck, AIG, Polycom",MRK,2013-08-14,0.00
841319,"Mid-Afternoon Market Update: Apple Rises Sharply On Icahn Stake, NASDAQ Pulled Upward",MRK,2013-08-13,0.28
841320,Mid-Day Market Update: US Stocks Edge Higher; Valspar Shares Decline On Downbeat Results,MRK,2013-08-13,0.00
841321,"Mid-Morning Market Update: Markets Drop, Yum China Same-Store Sales Down 13%",MRK,2013-08-13,-0.30
841322,Benzinga's Top Pre-Market Gainers,MRK,2013-08-13,0.15
841323,Avanir Pharmaceuticals Announces Diabetes Co-Promotion Agreement with Merck ,MRK,2013-08-12,0.02
841324,Hearing Unconfirmed Takeover Chatter in Inovio,MRK,2013-08-05,0.00
841325,"Apple, Wal-Mart And Other Companies With Monster Share Buyback (AAPL, WMT)",MRK,2013-08-05,-0.02
841326,S&P: Heaping Praise For Some Health Care ETFs,MRK,2013-08-02,0.35
841327,"Three Soaring, But Overlooked Health Care ETFs",MRK,2013-08-02,-0.26
841328,Bionomics Signs Option and License Agreement With Merck ,MRK,2013-07-31,0.02
841329,"Benzinga Market Primer: Wednesday, July 31: Futures Higher Heading Into FOMC Decision",MRK,2013-07-31,0.00
841330,SLIDESHOW: 8 Stocks to Benefit From a Repatriation Deal In Congress,MRK,2013-07-30,0.17
841331,"Benzinga's PreMarket Info Recap for July 30, 2013: Potash Smash!",MRK,2013-07-30,0.00
841332,UPDATE: Merck Posts Drop In Q2 Profit,MRK,2013-07-30,0.02
841333,"Merck & Company, Inc. Reports Q2 EPS of $0.84 vs $0.83 Est; Revenue of $11.0B vs $11.22B Est",MRK,2013-07-30,0.01
841334,"Benzinga Market Primer: Wednesday, July 30: Futures Higher After Asia Turnaround",MRK,2013-07-30,0.01
841335,Earnings Expectations for the Week of July 29,MRK,2013-07-28,0.01
841336,"Weekly Preview: Earnings Season Continues, Fed In Focus, Economic Maelstrom Expected",MRK,2013-07-26,0.01
841337,"Short Interest in Pharmacyclics Plunges (AMGN, ONXX, PCYC)",MRK,2013-07-26,-0.06
841338,"Merck Statement Regarding CHMP Review of Incretin-Based Therapies for Type 2 Diabetes, Including Sitagliptin ",MRK,2013-07-26,0.00
841339,"UPDATE: Merck Announces FDA Acceptance of New Drug Application for Vorapaxar, Investigational Anti-Thrombotic Medicine ",MRK,2013-07-24,0.15
841340,Merck Announces FDA Acceptance of NDA for Vorapaxar,MRK,2013-07-24,0.03
841341,"BMO Capital Downgrades Merck & Company, Inc. to Market Perform",MRK,2013-07-18,-0.34
841342,Merck in Talks with FDA to Identify Steps Needed for Review of Sugammadex Sodium Injection,MRK,2013-07-16,0.00
841343,Eli Lilly Tries Again with Alzheimer's Drug as the Race for a Cure Continues (LLY),MRK,2013-07-16,0.01
