Unnamed: 0,title,stock,Date,sentiment_score
840372,"After Roaring To New Highs on Jobs Data, Market Faces Retail Sales, Job Openings",MRK,2016-08-08,0.32
840373,"CheckMate Miss Is A Game Changer; Credit Suisse Downgrades Bristol, Upgrades Merck",MRK,2016-08-08,-0.09
840374,8 Biggest Price Target Changes For Monday,MRK,2016-08-08,0.02
840375,The Market in 5 Minutes: Can The Momentum Continue?,MRK,2016-08-08,0.07
840376,Benzinga's Top Upgrades,MRK,2016-08-08,0.15
840377,Citi Doesn't See Merck's Lung Cancer Success Lasting Long,MRK,2016-08-08,-0.46
840378,FDA Approves Merck's KEYTRUDA® (pembrolizumab) for Patients with Recurrent or Metastatic Head and Neck Squamous Cell Carcinoma with Disease Progression on or After Platinum-Containing Chemotherapy,MRK,2016-08-08,-0.01
840379,"Credit Suisse Upgrades Merck & Co to Outperform, Raises PT to $73.00",MRK,2016-08-08,0.10
840380,Watch These 5 Huge Put Purchases In Monday Trade,MRK,2016-08-08,0.03
840381,"BMO Capital Upgrades Merck To Outperform, Bullish On Co",MRK,2016-08-06,0.40
840382,"BMO Capital Upgrades Merck & Co to Outperform, Raises PT to $72.00",MRK,2016-08-05,0.11
840383,25 Biggest Mid-Day Gainers For Friday,MRK,2016-08-05,0.26
840384,Benzinga's Volume Movers,MRK,2016-08-05,0.01
840385,Stocks Hitting 52-Week Highs,MRK,2016-08-05,0.54
840386,Option Alert: MRK Oct16 60.0 Puts Sweep: 594 @  ASK  $1.71: 605 traded vs 1589 OI: $61.04 Ref,MRK,2016-08-05,0.00
840387,Bristol's Opdivo Misses Endpoint In Late-Stage Trial; Merck Rallies Sharply Amid Keytruda Potential,MRK,2016-08-05,-0.13
840388,The Market In 5 Minutes: Blowout Jobs Report Pushes Markets Higher,MRK,2016-08-05,0.15
840389,UPDATE: Merck's KEYTRUDA is Viewed as Strongest Competitor to Bristol's Opdivo,MRK,2016-08-05,0.03
840390,Merck Spike in Price Likely Attributed to Negative Results on Bristol-Myers' Opdivo,MRK,2016-08-05,-0.25
840391,Merck Shares Spiking ~$6 Over Last Min,MRK,2016-08-05,0.03
840392,Merck Reports Acceptance of FDA Filing for NDA for MK-1293,MRK,2016-08-05,0.01
840393,"Celgene Shares Spiking, Traders Circulating Takeover Chatter By Merck",MRK,2016-08-04,0.01
840394,"Benzinga's M&A Chatter for Wednesday August 3, 2016",MRK,2016-08-03,0.00
840395,Terms Of The Trade: Dogs Of The Dow Investing Strategy,MRK,2016-08-03,-0.07
840396,"Biogen Shares Down $3 Over Last Min Following Reuters Report Co. Not Soliciting Offers; Allergan, Merck Shares Relatively Quiet, Not Impacted",MRK,2016-08-03,0.00
840397,The Market In 5 Minutes: Downtrend Continues,MRK,2016-08-03,-0.06
840398,Why Is Biogen Attractive? Credit Suisse Sees 12-24% Upside Takeout Potential,MRK,2016-08-03,0.58
840399,"Benzinga's M&A Chatter for Tuesday August 2, 2016",MRK,2016-08-02,0.00
840400,6 Stocks Moving In Tuesday's After-Hours Session,MRK,2016-08-02,0.01
840401,Merck Reports KEYTRUDA Has Received EC Approval for Patients with NSCLC Whose Tumors Express PD-L1,MRK,2016-08-02,0.00
840402,"Wall Street Journal Reports Biogen Drawing Interest From Merck, Allergan On Possibility Of Huge Deal",MRK,2016-08-02,0.37
840403,"Merck's Q2 Good, But Not Good Enough, Says BMO",MRK,2016-08-01,0.10
840404,"Weak GDP Data, Plunging Oil Renew Questions About Strength Of Economy",MRK,2016-07-29,-0.61
840405,A Peek Into The Markets: U.S. Stock Futures Mostly Lower Ahead Of GDP Report,MRK,2016-07-29,-0.08
840406,Investors Greet Merck Q2 Results As Key Launches Help Beat,MRK,2016-07-29,0.31
840407,Merck Reports EC Granted Marketing Authorization for Co.'s ZEPATIER for Treatment of Chronic Hep C Infection,MRK,2016-07-29,0.00
840408,"Merck Narrows, Raises FY16 Adj. EPS Outlook from $3.60-$3.75 to $3.67-$3.77 vs $3.72 Est., Sales from $38.7B-$40.2B to $39.1B-$40.1B vs $39.5B Est.",MRK,2016-07-29,0.00
840409,"Merck Reports Q2 Adj. EPS $0.93 vs $0.91 Est., Sales $9.844B vs $9.78B Est.",MRK,2016-07-29,0.01
840410,12 Stocks You Should Be Watching Today,MRK,2016-07-29,0.03
840411,"Earnings Scheduled For July 29, 2016",MRK,2016-07-29,0.00
840412,Can Keytruda Deliver Earnings Growth For Merck?,MRK,2016-07-27,0.10
840413,Merck Gets Breakthrough Therapy Status From FDA And PRIME Status From EMA For Investigational Ebola Zaire Vaccine,MRK,2016-07-25,0.16
840414,"NewLink Genetics Announces Merck Receives Breakthrough Therapy Designation from FDA, PRIME Status from EMA for Investigational Ebola Zaire Vaccine",MRK,2016-07-25,0.22
840415,"Merck Reports Received Breakthrough Therapy Designation from FDA, PRIME Status from EMA for V920",MRK,2016-07-25,0.23
840416,Merck Receives Breakthrough Therapy Designation from FDA and PRIME Status from EMA for Investigational Ebola Zaire Vaccine,MRK,2016-07-25,0.16
840417,Merck Presents Data On Its Investigational Once-Daily Formulation Of ISENTRESS,MRK,2016-07-22,0.01
840418,"Merck Reports Investigational Once-Daily Formulation of ISENTRESS Showed Non-Inferior Efficacy, Safety to Regimen Containing Approved Twice-Daily Formulation",MRK,2016-07-22,-0.07
840419,"Merck Animal Health Receives FDA Approval of BRAVECTO For Cats And Dogs, Topical Treatment for Fleas and Ticks Effective for up to 12 Weeks",MRK,2016-07-21,0.03
840420,Merck Provides Regulatory Update on Biologics Licensing Application for Investigational Agent Bezlotoxumab,MRK,2016-07-21,0.02
840421,The Market In 5 Minutes: Jam-Packed Day Of Earnings And Economic Data,MRK,2016-07-21,0.00
840422,"Benzinga's M&A Chatter for Wednesday July 20, 2016",MRK,2016-07-20,0.00
840423,BMO Analysts Say Merck's Fundamentals Don't Justify Its Valuations,MRK,2016-07-18,-0.53
840424,Benzinga's Top Downgrades,MRK,2016-07-18,0.00
840425,BMO Capital Downgrades Merck & Co to Market Perform,MRK,2016-07-18,-0.23
840426,"Merck, Pfizer Report Initiation of Phase III Trial to Evaluate Avelumab as First-Line Treatment for Ovarian Cancer",MRK,2016-07-06,0.00
840427,"Merck Animal Health Announces Agreement to Acquire Controlling Interest In Brazilian Animal Health Company Vallée S.A., Will Acquire 93% Of Shares For $400M",MRK,2016-07-01,0.02
840428,Merck And Premier Join Hands To Prevent Fractures For Osteoporosis Patients,MRK,2016-06-30,0.02
840429,"Merck, Premier Report Collaboration to Prevent Fractures for Osteoporosis Patients",MRK,2016-06-30,0.01
840430,"Merck, Moderna Therapeutics Report Strategic Collaboration Related to Advancement of Novel mRNA-Based Personalized Cancer Vaccines with KEYTRUDA",MRK,2016-06-29,0.02
840431,Merck Gets CHMP Positive Opinion For KEYTRUDA For Advanced Non-Small Cell Lung Cancer Treatment,MRK,2016-06-27,0.05
840432,Merck Receives CHMP Positive Opinion for KEYTRUDA for the Treatment of Advanced Non-Small Cell Lung Cancer,MRK,2016-06-27,0.02
840433,UPDATE: Merck Says Pivotal Phase 3 Studies for Relebacatam Ongoing in Treatment of Serious Bacterial Infections,MRK,2016-06-20,0.00
840434,Merck Offers Results of Phase 2 Study for Relebactam in Combo with Imipenem/Cilastatin,MRK,2016-06-20,0.02
840435,Cramer Talks About Merck's 'Fabulous News' And Why The Market Can't Rally,MRK,2016-06-16,-0.13
840436,Merck Rallies Of Drug Trial Results,MRK,2016-06-16,-0.01
840437,Merck Announces Keytruda Met Primary and Secondary Endpoint,MRK,2016-06-16,0.03
840438,Jefferies Shares Pharma Stock Catalyst Outlook,MRK,2016-06-14,0.01
840439,Merck Reports MK-1293 Met Primary Endpoint in Two Phase 3 Studies,MRK,2016-06-13,0.07
840440,"Has Cancer Research Become Cancerous? Same Cancer Strategy Targeted By 'Too Many Drugmakers,' Say Regulators",MRK,2016-06-13,-0.64
840441,"Merck, Pfizer Announce Two Pivotal Phase 3 Studies for Ertugliflozin Met Primary Endpoints, Showing Significant A1C Reductions in Patients with Type 2 Diabetes at the American Diabetes Association's 76th Scientific Sessions",MRK,2016-06-12,0.14
840442,"UPDATE: Merck To Pay $500M Cash Upfront, Afferent Holders Eligible FOr Addition $750M Tied To 'clinical development and commercial milestones for multiple indications and candidates, including AF-219'",MRK,2016-06-09,0.01
840443,Merck To Acquire Afferent Pharmaceuticals,MRK,2016-06-09,-0.09
840444,"Hearing FDA Panel Has Said Merck Has Provided Substantial Evidence of Safety, Effectiveness of Bezlotoxumab",MRK,2016-06-09,0.10
840445,BZ NOTE: Relypsa Shares Still Up $0.20-$0.40 from Where Stock Was Trading Prior to Apparent Rumor Manipulation Ahead of Negative StreetSweeper Report (See Body of This Headline for More),MRK,2016-06-09,-0.28
840446,"Hearing Merck May Be Interested In RLYP, Unconfirmed Takeover Chatter",MRK,2016-06-09,0.00
840447,"Agenus Reports Lead Product Candidate Selection in its Collab with Merck, Received First Milestone Payment of $2M",MRK,2016-06-09,0.27
840448,"Merck Says Ruling Reversal in Gilead Case 'Doesn't Reflect the Facts,' Co. Will Appeal Ruling Overturn",MRK,2016-06-07,-0.28
840449,Goldman Confident In Merck's Keytruda,MRK,2016-06-07,0.02
840450,FDA Staff Has Said Overall Clinical Results from Merck's Bezlotoxumab Trial Could Negatively Impact Cure Rate of Initial Episode of Infection with C. Difficile,MRK,2016-06-07,-0.40
840451,US Judge Rules Gilead Won't have to Pay $200M Jury Verdict to Merck in Hepatitis C Patent Dispute -Reuters,MRK,2016-06-06,-0.50
840452,4 Key Takeaways From ASCO,MRK,2016-06-06,0.02
840453,"Merck, Pfizer Offers Results from Pivotal Avelumab Study",MRK,2016-06-06,0.01
840454,Merck Reports Response Rates from KEYNOTE-055 Show Nearly One in Five Patients Respond with KEYTRUDA,MRK,2016-06-06,0.01
840455,Merck Announces New Data from Phase 2 Study Evaluating KEYTRUDA for the Treatment of Cancers Deficient in DNA Mismatch Repair Show Durable Responses Across a Range of Cancers at #ASCO16,MRK,2016-06-05,-0.01
840456,Lilly Announces Encouraging Data of Early-Phase Immuno-Oncology Studies of ALIMTA and CYRAMZA with Merck's KEYTRUDA in NSCLC Presented at #ASCO16,MRK,2016-06-05,0.31
840457,"Merck Announces New Data for KEYTRUDA in Combination with Talimogene Laherparepvec, Dabrafenib Plus Trametinib, or Low-Dose Ipilimumab in Advanced Melanoma Presented at #ASCO16",MRK,2016-06-05,0.03
840458,New Data Evaluating KEYTRUDA in Combination with Chemotherapy for First-Line Treatment of NSCLC Demonstrate Response Rates Ranging of 48%71%; Data to be Presented at #ASCO16,MRK,2016-06-04,0.00
840459,"New KEYTRUDA Data from KEYNOTE-010 and KEYNOTE-001 in Advanced NSCLC, Including Survival Data, to be Presented at #ASCO16",MRK,2016-06-04,0.01
840460,"Ouch! Jobs Report Miss Sends Rate Hike Odds Down, Raises Questions",MRK,2016-06-03,-0.58
840461,Merck Gets Favorable Opinion From CHMP For Its ZEPATIER,MRK,2016-05-27,0.05
840462,Merck Receives Positive CHMP Opinion for ZEPATIER in the European Union,MRK,2016-05-27,0.31
840463,Celgene Rallies Of Possible Interest From Merck,MRK,2016-05-26,0.00
840464,"Celgene Shares Spiking, Traders Passing Vague Comments Of Possible Interest From Merck",MRK,2016-05-26,0.00
840465,Chardan Initiates Asterias Biotherapeutics At Buy On Potential Cell Therapy Competitiveness,MRK,2016-05-23,0.01
840466,JPMorgan's Take On Big Pharma's New ASCO Abstracts,MRK,2016-05-19,-0.01
840467,Merck To Present New And Updated Data On KEYTRUDA,MRK,2016-05-16,0.01
840468,"Berenberg Unimpressed With Pfizer, Initiates Coverage At Hold",MRK,2016-05-12,-0.30
840469,Merck To Present Final Stage Data On Investigational Medicines Ertugliflozin And MK-1293,MRK,2016-05-12,0.01
840470,What's M&A Like In The Biotech Sector Right Now?,MRK,2016-05-06,0.00
840471,Mid-Afternoon Market Update: U.S. Stocks Turn Lower; Zynga Shares Rise Following Earnings Beat,MRK,2016-05-05,0.01
840472,Merck Lower After Mixed Q1 Report,MRK,2016-05-05,0.00
840473,Mid-Day Market Update: Fitbit Slides  On Weak Outlook; Atlas Air Worldwide Shares Shares Spike Higher,MRK,2016-05-05,-0.04
840474,Mid-Morning Market Update: Markets Edge Higher; Merck Profit Beats Views,MRK,2016-05-05,0.16
840475,"Merck Launch of Zepatier  in EU May be Delayed Until Late 2016, Early 2017 as Regulator Inspects Record-Keeping of Third Party Manufacturer -Reuters",MRK,2016-05-05,-0.19
840476,"Merck's Q1 Adjusted Profit beats, But Revenue Miss, Narrows Adjusted EPS FY16 Forecast",MRK,2016-05-05,-0.01
840477,Merck Sees FY 2016 EPS $3.65 to $3.77 vs $3.71 est,MRK,2016-05-05,0.00
840478,"Merck Q1 EPS $0.89 vs $0.85 est, Revenue $9.3B vs $9.5B est",MRK,2016-05-05,0.01
840479,"12 Stocks To Watch For May 5, 2016",MRK,2016-05-05,0.01
840480,"Earnings Scheduled For May 5, 2016",MRK,2016-05-05,0.00
840481,"TheStreet's Adam Feuerstein Tweets '$MRK $BMY are not working with $NWBO on cancer immunotherapy combination clinical trials, per their respective spokespersons.'",MRK,2016-05-03,0.00
840482,Earnings: Drug Makers Merck And Pfizer Report Q1 Results,MRK,2016-05-02,0.00
840483,"The Market In 5 Minutes: May, She Will Stay",MRK,2016-05-02,0.02
840484,Merck And Pfizer Earnings: Will They Beat Expectations Again?,MRK,2016-05-01,0.65
840485,Pharma Names Under Pressure Amid Perrigo Warning,MRK,2016-04-25,-0.07
840486,"Merck Animal Health To Acquire Rights To Whisper Veterinary Stethoscope System, Terms Not Disclosed",MRK,2016-04-19,0.00
840487,"Merck Gives Statement On Blueprint Project Findings AT AACR, Encouraged By Findings And Eager To Support Greater Biomarker Testing Use",MRK,2016-04-19,0.56
840488,Merck Reports Received Breakthrough Therapy Designation from FDA for KEYTRUDA in cHL,MRK,2016-04-18,0.12
840489,Merck Announces Results From Phase 3 Studies of ZEPATIER in Chronic Hep C Patient Populations at ILC,MRK,2016-04-16,0.00
840490,"Jefferies Maintains Hold on Merck & Co, Raises PT to $54.00",MRK,2016-04-15,0.00
840491,"After-Hours Recap: Big Banks, Liquidity Services's DoD Deal, Haemonetics' CFO & More",MRK,2016-04-14,-0.02
840492,Merck Kgaa Says Filed Answer in Response to Trademark Right Violation Claims Made By Merck,MRK,2016-04-14,-0.02
840493,Merck's ZEPATIER Showed Superiority on Efficacy and Safety Endpoints vs Sofosbuvir Plus Peginterferon and Ribavirin Treatment Regimen in Phase 3 Trial,MRK,2016-04-14,0.28
840494,Merck Says FDA Accepts Its sBLA For Keytruda And Grants Priority Review,MRK,2016-04-13,0.01
840495,"FDA Accepts Supplemental Biologics License Application for Merck's KEYTRUDA in Recurrent or Metastatic Head and Neck Cancer, and Grants Priority Review",MRK,2016-04-13,0.01
840496,Merck Announces License Application for Investigational House Dust Mite SLIT-tablet Accepted for Review by FDA,MRK,2016-04-13,0.01
840497,"Baird: Gilead Set For Q1 EPS Miss, But Hep C Trends Still Good Long Term",MRK,2016-04-12,0.01
840498,"Notable Imbalances Before Tuesday's Open Led By Under Armour, Boeing, Caterpillar",MRK,2016-04-12,0.00
840499,How One Analyst Is Playing The Biotech Rebound This Week,MRK,2016-04-07,0.02
840500,"BZ NOTE: Relypsa Has Been Mentioned In Rumors Over Past 7 Months In Possible M&A Talk With Sanofi, Merck, Astra Zeneca",MRK,2016-04-07,0.00
840501,"PPH May Be Home To Hedge Fund Hotels, But This ETF Can Endure",MRK,2016-04-06,-0.01
840502,SocGen Picks New Favorites In Big Pharma,MRK,2016-04-06,-0.05
840503,Societe Generale Initiates Coverage on Merck & Co at Buy,MRK,2016-04-06,0.01
840504,Merck Will Present New KEYTRUDA Data At AACR Meeting Apr. 16-20th,MRK,2016-04-06,0.01
840505,WHO Says Number of Adults with Diabetes has Quadrupled Since 1980 -AFP,MRK,2016-04-06,-0.03
840506,"Advaxis, Merck Combination Trial Evaluating ADXS-PSA Launches Third Dose-Escalation Cohort",MRK,2016-04-05,0.01
840507,"The Stocks That Moved The S&P, Dow And Nasdaq Today",MRK,2016-04-04,0.07
840508,This Data Signals The End For Merck's Anacetrapib,MRK,2016-04-04,-0.01
840509,Make A House Call With A Familiar Healthcare ETF,MRK,2016-04-04,-0.01
840510,"Biopharma Names LLY, PFE, MRK, And More Popping Higher Following Reports China FDA To Investigate Improper Vaccine Trading",MRK,2016-03-28,-0.03
840511,Data Shows Gilead's HCV Franchise Is Surviving New Competition,MRK,2016-03-28,0.18
840512,"Patent Expert: It's Not Over For Gilead, Still Has Strong Defense Against Merck",MRK,2016-03-24,0.35
840513,Jury Rules Merck Patents Valid…Bad For Gilead?,MRK,2016-03-23,-0.38
840514,Gilead -2.5% Premarket Following Verdict Tuesday Validating Merck's Hep C Patents,MRK,2016-03-23,0.01
840515,Organovo Is A Company 3D Printing Human Tissue And Its CEO Is Excited About Creating Livers,MRK,2016-03-17,0.49
840516,Agenus Shares Spike Higher Following Mid-Day Upgrade To Buy From Maxim,MRK,2016-03-12,0.33
840517,"The Stocks That Moved The S&P, Dow And Nasdaq Today",MRK,2016-03-10,0.07
840518,Jimmy Carter Boosts Social Media Buzz For Merck's Blockbuster Drug,MRK,2016-03-08,0.21
840519,"Sanofi Pasteur, Merck Report Intent to End Joint Vaccines Operations in Europe, Sanofi Pasteur MSD, to Pursue Their Own Distinct Growth Strategies",MRK,2016-03-08,0.01
840520,Gilead Vs. Merck: What To Know,MRK,2016-03-07,0.01
840521,FDA Accepts Supplemental Biologics License Application For Keytruda,MRK,2016-03-07,0.02
840522,"UPDATE: Merck, Pfizer, and Verastem Combination Trial Of Avelumab and VS-6063 Expected To Begin In 2nd Half 2016",MRK,2016-03-03,0.00
840523,"Merck KGaA, Darmstadt, Germany, Pfizer and Verastem Report Combination Trial of Avelumab and VS-6063 in Ovarian Cancer",MRK,2016-03-03,-0.01
840524,"Watch Pharma Names Following FDA Issuance Of New Mandatory Clinical Study For Bayer's 'Essure', Requires Product Labeling, Including Box Warnings And Patient Decision Checklist",MRK,2016-02-29,0.00
840525,3 Mega Biotechs Leerink Loves,MRK,2016-02-29,0.78
840526,AureoGen Announces Licensing Agreement with Merck,MRK,2016-02-24,0.02
840527,Will Merck Encroach On Gilead's Harvoni Territory?,MRK,2016-02-23,-0.03
840528,"8,383 Patients Contacted to Arrange Blood Test Following Possible Exposure to ex-NHS Worker with Hepatitis C -Sky News",MRK,2016-02-23,-0.15
840529,"Merck Reports Investigational One-Daily Formulation of ISENTRESS Met Primary, Secondary Endpoints in Pivotal Phase 3 Trial",MRK,2016-02-22,0.03
840530,ALK Announces Merck Submits BLA to FDA for Investigational House Dust Mite SLIT-tablet,MRK,2016-02-10,-0.02
840531,How To Invest In An Aging World With The 'Live Long & Prosper' ETF,MRK,2016-02-08,0.22
840532,A Checkup On A Big Healthcare ETF,MRK,2016-02-05,0.00
840533,How To Build A Defensive Portfolio,MRK,2016-02-04,0.02
840534,25 Companies That Could Still Buy Back Mountains Of Stock,MRK,2016-02-04,0.00
840535,"ImmunoGen, Merck Partner For Clincial Evaluation Of Mirvetuximab Soravtansine With Keytruda Combination For Ovarian Cancer Treatment",MRK,2016-02-04,0.00
840536,"Merck & Co., Inc. Falters After Q4 Report",MRK,2016-02-03,-0.23
840537,Joe McCann: Here's How To Play Biotech Market In Earnings Season,MRK,2016-02-03,0.00
840538,Shares Of Merck Dip Lower Following Q4 Print,MRK,2016-02-03,-0.01
840539,"Merck Sees FY16 EPS $3.60-$3.75 vs. Est. $3.72, Rev. $38.7-$40.2B vs. Est. $40.25B",MRK,2016-02-03,0.00
840540,"Merck Reports Q4 EPS $0.93 vs. Est. $0.91, Rev. $10.215B vs. Est. $10.35B",MRK,2016-02-03,0.00
840541,Merck Sees FY 2016 EPS $3.60 to $3.75 vs $3.72 est,MRK,2016-02-03,0.00
840542,Merck Sees FY 2016 Revenue $38.7B vs $40.2B est,MRK,2016-02-03,0.00
840543,"Merck Q4 EPS $0.93 vs $0.91 est, Revenue $10.2B vs $10.4B est",MRK,2016-02-03,0.01
840544,"Keep an Eye on These 10 Stocks for February 3, 2016",MRK,2016-02-03,0.00
840545,"Earnings Scheduled For February 3, 2016",MRK,2016-02-03,0.00
840546,"Merck, Sanofi Exploring Potential End To Joint Venture In Europe",MRK,2016-02-02,0.01
840547,"Sanofi, Merck Considering Ending JV to Sell Vaccines in Europe -Bloomberg",MRK,2016-02-02,-0.03
840548,"Earnings: Pharma Tends to Top Street Estimate—Can PFE, MRK Repeat?",MRK,2016-02-01,0.01
840549,"Stock Marquee is Crowded in Week Ahead: Oil, Earnings, Labor Data",MRK,2016-02-01,-0.16
840550,Mixed Earnings Expectations For Merck And Pfizer,MRK,2016-01-31,-0.15
840551,Gilead Hits New 52-Week Low; Here Are Two Reasons Why,MRK,2016-01-29,-0.05
840552,"Merck Confirms FDA Approval Of Hep C Drug At A Cost Of $54,600 Per Patient",MRK,2016-01-29,-0.02
840553,From Conf Call: Abbvie Says Merck's New Hep C Drug Will Crimp Viekira Pak Sales,MRK,2016-01-29,0.00
840554,"Merck Receives FDA Approval of Hep C Drug ZEPATIER; To Cost $54,600/Patient for 12-Week Course",MRK,2016-01-28,0.01
840555,Adam Feurestein Reminds Twitter Followers 'Today Is Merck's HepC elbasvir/grazoprevir PDUFA',MRK,2016-01-28,0.01
840556,Adam Feuerstein @adamfeuerstein Tweet: Reminder: Today is $MRK HepC elbasvir/grazoprevir PDUFA. Co. spox knows first and most important post-approval question is: What price?,MRK,2016-01-28,0.01
840557,Fast Money Picks For January 28,MRK,2016-01-28,0.02
840558,Abbott to Sell ALK's House Dust Mite Sublingual Allergy Immunotherapy Tablet in SE Asia,MRK,2016-01-28,0.00
840559,Bank of America Downgrades Merck & Co to Neutral,MRK,2016-01-27,-0.15
840560,Merck Reports FDA Acceptance of Biologics License Application for Bezlotoxumab,MRK,2016-01-27,0.01
840561,Merck Reports FDA Acceptance of BLA for Bezlotoxumab,MRK,2016-01-27,0.02
840562,ACARIZAX Receives Marketing Authorization in France,MRK,2016-01-27,0.05
840563,US Big Pharma: What To Watch For In Q4 Results,MRK,2016-01-25,0.01
840564,Affimed to Collaborate with Merck to Evaluate AFM13 in Combination with KEYTRUDA for Patients with Hodgkin Lymphoma,MRK,2016-01-25,0.00
840565,Sierra Leone Confirms Second New Ebola Case in Less than a Week -Reuters,MRK,2016-01-20,-0.01
840566,"Credit Suisse Sets Outperform Rating, $125 Target On Gilead Story",MRK,2016-01-20,0.05
840567,Global Vaccine's Alliance Signs $5M Advance Order for Merck's Ebola Vaccine -Reuters,MRK,2016-01-20,0.00
840568,Write A Prescription For This Healthcare ETF,MRK,2016-01-15,-0.06
840569,"Merck Announces Resolution of Vioxx Class Action Lawsuit, Cash Payment ~$680M",MRK,2016-01-15,0.00
840570,UPDATE: Sierra Leone Ebola Victim Said to have Exposed 27 to Disease; Woman was Living in House With 22 People When She Became Ill -Reuters,MRK,2016-01-15,-0.54
840571,UPDATE: Sierra Leone Health Ministry Confirms Death from Ebola -Reuters,MRK,2016-01-15,-0.25
840572,Sierra Leone Health Ministry Investigating Suspected Death from Ebola -Reuters,MRK,2016-01-14,-0.17
840573,WHO to Announce End of Ebola Outbreak on Thursday -AFP,MRK,2016-01-13,-0.06
840574,Fast Money Traders Share Their Biotech Picks,MRK,2016-01-12,0.02
840575,"Merck Acquires IOmet Pharma, Terms Not Disclosed",MRK,2016-01-11,0.01
840576,Why This Codexis Analyst Is Confident Stock Is Worth $6,MRK,2016-01-06,0.09
840577,Washington University Initiates Clinical Study of Verastem's VS-6063 in Combination with Merck's Pembrolizumab and Gemcitabine in Pancreatic Cancer,MRK,2016-01-06,0.00
840578,"Watch Stocks of Small-, Mid-Cap Cos. with Experimental Drugs as AP Reporting Merck CEO Frazier at Goldman Healthcare Conference Said Co. 'Raring to Go' on M&A Deals This Year",MRK,2016-01-05,0.01
840579,ANI Pharma Reports Closing of Deal to Purchase Two NDAs from Merck for $75M,MRK,2016-01-05,0.02
840580,"Pfizer, Merck KGaA Report Syndax to Collab to Investigate Safety, Tolerability, Prelim. Efficacy of Avelumab, Entinostat in Advanced Ovarian Cancer",MRK,2016-01-04,0.00
840581,WHO Declares End of Ebola Virus Transmission in  Republic of Guinea,MRK,2015-12-29,-0.21
840582,Peering Through The Fog To Find The Best Sectors Into Year End,MRK,2015-12-23,0.20
840583,"Merck KGaA, Pfizer Report Advancement of Clinical Development Program with Two Added Phase III Trials of Avelumab",MRK,2015-12-22,0.04
840584,Merck CEO: Using Keytruda Could Extend Patient's Life By 13 Months On Average,MRK,2015-12-21,0.27
840585,ALK Sells European Veterinary Business to Fidelio Capital; Terms Not Disclosed,MRK,2015-12-21,0.00
840586,Credit Suisse Offers 2016 U.S. Large-Cap Pharma Outlook,MRK,2015-12-19,0.01
840587,Merck's KEYTRUDA Significantly Improves Survival Compared to Chemotherapy in Previously-Treated Patients with Non-Small Cell Lung Cancer Whose Tumors Express Any Level of PD-L1,MRK,2015-12-19,0.45
840588,Merck Reports FDA Approval of Expanded Indication for KEYTRUDA for Treatment of Patients with Advanced Melanoma,MRK,2015-12-18,0.01
840589,"Merck Reports EMA's CHMP Has Responded to MAA for elbasvir/grazoprevir (50mg/100mg), Application Will Now Be Reviewed on Standard Timetable",MRK,2015-12-18,0.00
840590,"Codexis +7.1% Premarket @$4.50;, Co Announces Agreement Extension With Merck",MRK,2015-12-18,0.02
840591,UPDATE: Merck Says Expanded Age Indication for GARDASIL 9 Includes 16-26 Age Range,MRK,2015-12-15,0.00
840592,Merck Announces FDA Approval for Expanded Age Indication for GARDASIL 9 in Males,MRK,2015-12-15,0.08
840593,FDA Approves Bridion To Reverse Effects Of Neuromuscular Blocking Drugs Used In Surgery,MRK,2015-12-15,0.02
840594,Fast Money Picks For December 15,MRK,2015-12-15,0.01
840595,Hearing FDA Panel Has Voted IMPROVE-IT Data for Merck's Zetia to Statin Therapy Does Not Support Claim of Reduced Risk of CV Events,MRK,2015-12-14,0.02
840596,Major Pharma Group Outlook In 2016: Fundamentals To Outweigh Political Headwinds,MRK,2015-12-12,0.00
840597,9 Healthcare Picks For 2016,MRK,2015-12-10,0.00
840598,UPDATE: Merck Says Biothera Research Shows Imprime PGG Activates Key Immune Responses,MRK,2015-12-10,0.00
840599,Biothera Announces Clinical Study to Evaluate Combination Therapy of Imprime PGG,MRK,2015-12-10,-0.01
840600,Eli Lilly and Merk Announces Expansion of Immuno Oncology Collaboration,MRK,2015-12-10,0.10
840601,"Merck Reports Samsung Bioepis Receives Approval of RENFLEXIS, a Biosimilar of Remicade, in Korea",MRK,2015-12-07,0.09
840602,Must Watch Stocks for Today,MRK,2015-12-07,0.42
840603,Benzinga's Weekend M&A Chatter,MRK,2015-12-06,0.01
840604,Merck Spokesperson Declines Comment on Speculation Related to Relypsa,MRK,2015-12-04,-0.06
840605,EXCLUSIVE: Relypsa Being Evaluated By 3-4 Potential Acquirers; Sanofi Seen As 'Natural Buyer',MRK,2015-12-04,0.02
840606,EXCLUSIVE: Wedbush's Liana Moussatos Tells Benzinga Sanofi 'is a natural buyer of Relypsa',MRK,2015-12-04,0.01
